{
  "contractVersion": "sdar.domain-projection/v1",
  "deadLetterId": "fixture-dead-letter-missing-identity",
  "projectionId": "fixture.projection.alpha",
  "projectionVersion": 1,
  "sourceDatabase": "sdar_commander",
  "sourceTable": "fixture_source_fact",
  "sourceRecordId": null,
  "sourceRevision": null,
  "sourceContentHash": "sha256:3333333333333333333333333333333333333333333333333333333333333333",
  "failureCode": "SOURCE_IDENTITY_MISSING",
  "failureClass": "non_retryable",
  "failureSummary": "The source record does not expose a deterministic identity.",
  "attemptCount": 1,
  "firstFailedAt": "2026-08-14T00:04:00.000Z",
  "lastFailedAt": "2026-08-14T00:04:00.000Z",
  "status": "open"
}
